{
  "schema_version": "chesstory.move-review.job-request.v5",
  "request_id": "fixture.g1f3",
  "variant": "standard",
  "initial_fen": "rnbqkbnr/pppppppp/8/8/8/8/PPPPPPPP/RNBQKBNR w KQkq - 0 1",
  "move_prefix_uci": [],
  "before_fen": "rnbqkbnr/pppppppp/8/8/8/8/PPPPPPPP/RNBQKBNR w KQkq - 0 1",
  "played_move_uci": "g1f3",
  "after_fen": "rnbqkbnr/pppppppp/8/8/8/5N2/PPPPPPPP/RNBQKB1R b KQkq - 1 1",
  "engine_profile": "sf18-smallnet-t2-h16-v1"
}
